(n,d,k);LetterGematriaNumberValue;Letter;LetterPositionIndex;LetterCoordinatesD5K;Found in Word in Text;LetterPositionIndex In Word;WordNumber;WordCoordinatesDWTK;WordNumberInVerse;Found In Verse
(4676, 70, 5);4;ד;4676;(1, 4, 11, 16, 4676);האדמה;3;1237;(1, 4, 11, 5, 1237);5;ועתה ארור אתה מן האדמה אשר פצתה את פיה לקחת את דמי אחיך מידך
(4676, 70, 5);6;ו;4746;(1, 4, 13, 1, 4746);ויאמר;1;1260;(1, 4, 13, 1, 1260);1;ויאמר קין אל יהוה גדול עוני מנשוא
(4676, 70, 5);50;נ;4816;(1, 4, 14, 44, 4816);ונד;2;1278;(1, 4, 14, 12, 1278);12;הן גרשת אתי היום מעל פני האדמה ומפניך אסתר והייתי נע ונד בארץ והיה כל מצאי יהרגני
(4676, 70, 5);30;ל;4886;(1, 4, 15, 49, 4886);לבלתי;3;1297;(1, 4, 15, 14, 1297);14;ויאמר לו יהוה לכן כל הרג קין שבעתים יקם וישם יהוה לקין אות לבלתי הכות אתו כל מצאו
(4676, 70, 5);4;ד;4956;(1, 4, 17, 21, 4956);ותלד;4;1316;(1, 4, 17, 6, 1316);6;וידע קין את אשתו ותהר ותלד את חנוך ויהי בנה עיר ויקרא שם העיר כשם בנו חנוך
