(254136, -68, 4);[2, 5, 200, 1];208;ארהב;66764;(5, 2, 30, 16, 66764);לבבו;3;(5, 2, 30, 56, 254136);ולא אבה סיחן מלך חשבון העברנו בו כי הקשה יהוה אלהיך את רוחו ואמץ את לבבו למען תתו בידך כיום הזה
(289086, -68, 4);[2, 5, 200, 1];208;ארהב;75922;(5, 26, 2, 15, 75922);בטנא;1;(5, 26, 2, 55, 289086);ולקחת מראשית כל פרי האדמה אשר תביא מארצך אשר יהוה אלהיך נתן לך ושמת בטנא והלכת אל המקום אשר יבחר יהוה אלהיך לשכן שמו שם
(291249, -68, 4);[2, 5, 200, 1];208;ארהב;76467;(5, 27, 20, 5, 76467);אביו;2;(5, 27, 20, 14, 291249);ארור שכב עם אשת אביו כי גלה כנף אביו ואמר כל העם אמן
(292516, -68, 4);[2, 5, 200, 1];208;ארהב;76802;(5, 28, 20, 18, 76802);אבדך;2;(5, 28, 20, 63, 292516);ישלח יהוה בך את המארה את המהומה ואת המגערת בכל משלח ידך אשר תעשה עד השמדך ועד אבדך מהר מפני רע מעלליך אשר עזבתני
(300017, -68, 4);[2, 5, 200, 1];208;ארהב;78726;(5, 31, 23, 13, 78726);בני;1;(5, 31, 23, 40, 300017);ויצו את יהושע בן נון ויאמר חזק ואמץ כי אתה תביא את בני ישראל אל הארץ אשר נשבעתי להם ואנכי אהיה עמך
(29206, -67, 4);[2, 5, 200, 1];208;ארהב;7800;(1, 23, 17, 20, 7800);סביב;4;(1, 23, 17, 74, 29206);ויקם שדה עפרון אשר במכפלה אשר לפני ממרא השדה והמערה אשר בו וכל העץ אשר בשדה אשר בכל גבלו סביב
(29433, -67, 4);[2, 5, 200, 1];208;ארהב;7863;(1, 24, 3, 1, 7863);ואשביעך;4;(1, 24, 3, 4, 29433);ואשביעך ביהוה אלהי השמים ואלהי הארץ אשר לא תקח אשה לבני מבנות הכנעני אשר אנכי יושב בקרבו
(184714, -67, 4);[2, 5, 200, 1];208;ארהב;48825;(3, 27, 2, 3, 48825);בני;1;(3, 27, 2, 6, 184714);דבר אל בני ישראל ואמרת אלהם איש כי יפלא נדר בערכך נפשת ליהוה
(248264, -67, 4);[2, 5, 200, 1];208;ארהב;65242;(4, 35, 19, 7, 65242);בפגעו;1;(4, 35, 19, 20, 248264);גאל הדם הוא ימית את הרצח בפגעו בו הוא ימתנו
(251804, -67, 4);[2, 5, 200, 1];208;ארהב;66155;(5, 1, 33, 11, 66155);בדרך;1;(5, 1, 33, 45, 251804);ההלך לפניכם בדרך לתור לכם מקום לחנתכם באש לילה לראתכם בדרך אשר תלכו בה ובענן יומם
(304441, -67, 4);[2, 5, 200, 1];208;ארהב;79878;(5, 34, 6, 4, 79878);בארץ;1;(5, 34, 6, 12, 304441);ויקבר אתו בגי בארץ מואב מול בית פעור ולא ידע איש את קברתו עד היום הזה
(12367, -66, 4);[2, 5, 200, 1];208;ארהב;3315;(1, 10, 23, 1, 3315);ובני;2;(1, 10, 23, 2, 12367);ובני ארם עוץ וחול וגתר ומש
(156401, -66, 4);[2, 5, 200, 1];208;ארהב;41269;(3, 11, 24, 8, 41269);הערב;4;(3, 11, 24, 32, 156401);ולאלה תטמאו כל הנגע בנבלתם יטמא עד הערב
(243581, -66, 4);[2, 5, 200, 1];208;ארהב;64073;(4, 32, 30, 7, 64073);בתככם;1;(4, 32, 30, 27, 243581);ואם לא יעברו חלוצים אתכם ונאחזו בתככם בארץ כנען
(259234, -66, 4);[2, 5, 200, 1];208;ארהב;68092;(5, 4, 46, 7, 68092);בארץ;1;(5, 4, 46, 24, 259234);בעבר הירדן בגיא מול בית פעור בארץ סיחן מלך האמרי אשר יושב בחשבון אשר הכה משה ובני ישראל בצאתם ממצרים
(280884, -66, 4);[2, 5, 200, 1];208;ארהב;73704;(5, 19, 10, 5, 73704);בקרב;4;(5, 19, 10, 16, 280884);ולא ישפך דם נקי בקרב ארצך אשר יהוה אלהיך נתן לך נחלה והיה עליך דמים
(283164, -66, 4);[2, 5, 200, 1];208;ארהב;74321;(5, 21, 10, 10, 74321);ושבית;3;(5, 21, 10, 39, 283164);כי תצא למלחמה על איביך ונתנו יהוה אלהיך בידך ושבית שביו
(284297, -66, 4);[2, 5, 200, 1];208;ארהב;74629;(5, 22, 6, 16, 74629);רבצת;2;(5, 22, 6, 53, 284297);כי יקרא קן צפור לפניך בדרך בכל עץ או על הארץ אפרחים או ביצים והאם רבצת על האפרחים או על הביצים לא תקח האם על הבנים
(34125, -65, 4);[2, 5, 200, 1];208;ארהב;9088;(1, 25, 28, 7, 9088);בפיו;1;(1, 25, 28, 20, 34125);ויאהב יצחק את עשו כי ציד בפיו ורבקה אהבת את יעקב
(46973, -65, 4);[2, 5, 200, 1];208;ארהב;12517;(1, 32, 10, 12, 12517);שוב;3;(1, 32, 10, 47, 46973);ויאמר יעקב אלהי אבי אברהם ואלהי אבי יצחק יהוה האמר אלי שוב לארצך ולמולדתך ואיטיבה עמך
(99013, -65, 4);[2, 5, 200, 1];208;ארהב;26126;(2, 14, 17, 14, 26126);ובפרשיו;2;(2, 14, 17, 58, 99013);ואני הנני מחזק את לב מצרים ויבאו אחריהם ואכבדה בפרעה ובכל חילו ברכבו ובפרשיו
(149793, -65, 4);[2, 5, 200, 1];208;ארהב;39514;(3, 7, 18, 11, 39514);המקריב;6;(3, 7, 18, 45, 149793);ואם האכל יאכל מבשר זבח שלמיו ביום השלישי לא ירצה המקריב אתו לא יחשב לו פגול יהיה והנפש האכלת ממנו עונה תשא
(169894, -65, 4);[2, 5, 200, 1];208;ארהב;44957;(3, 18, 24, 3, 44957);בכל;1;(3, 18, 24, 8, 169894);אל תטמאו בכל אלה כי בכל אלה נטמאו הגוים אשר אני משלח מפניכם
(204493, -65, 4);[2, 5, 200, 1];208;ארהב;53907;(4, 9, 13, 19, 53907);הקריב;5;(4, 9, 13, 74, 204493);והאיש אשר הוא טהור ובדרך לא היה וחדל לעשות הפסח ונכרתה הנפש ההוא מעמיה כי קרבן יהוה לא הקריב במעדו חטאו ישא האיש ההוא
(208823, -65, 4);[2, 5, 200, 1];208;ארהב;55030;(4, 12, 2, 10, 55030);דבר;2;(4, 12, 2, 32, 208823);ויאמרו הרק אך במשה דבר יהוה הלא גם בנו דבר וישמע יהוה
(281955, -65, 4);[2, 5, 200, 1];208;ארהב;73993;(5, 20, 8, 18, 73993);לבב;3;(5, 20, 8, 65, 281955);ויספו השטרים לדבר אל העם ואמרו מי האיש הירא ורך הלבב ילך וישב לביתו ולא ימס את לבב אחיו כלבבו
(284762, -65, 4);[2, 5, 200, 1];208;ארהב;74755;(5, 22, 17, 5, 74755);דברים;2;(5, 22, 17, 16, 284762);והנה הוא שם עלילת דברים לאמר לא מצאתי לבתך בתולים ואלה בתולי בתי ופרשו השמלה לפני זקני העיר
(54406, -64, 4);[2, 5, 200, 1];208;ארהב;14490;(1, 37, 7, 13, 14490);תסבינה;3;(1, 37, 7, 54, 54406);והנה אנחנו מאלמים אלמים בתוך השדה והנה קמה אלמתי וגם נצבה והנה תסבינה אלמתיכם ותשתחוין לאלמתי
(101630, -64, 4);[2, 5, 200, 1];208;ארהב;26801;(2, 16, 8, 7, 26801);בשר;1;(2, 16, 8, 23, 101630);ויאמר משה בתת יהוה לכם בערב בשר לאכל ולחם בבקר לשבע בשמע יהוה את תלנתיכם אשר אתם מלינם עליו ונחנו מה לא עלינו תלנתיכם כי על יהוה
(132502, -64, 4);[2, 5, 200, 1];208;ארהב;34985;(2, 35, 32, 5, 34985);ובכסף;2;(2, 35, 32, 20, 132502);ולחשב מחשבת לעשת בזהב ובכסף ובנחשת
(141057, -64, 4);[2, 5, 200, 1];208;ארהב;37179;(2, 40, 26, 4, 37179);הזהב;4;(2, 40, 26, 14, 141057);וישם את מזבח הזהב באהל מועד לפני הפרכת
(161023, -64, 4);[2, 5, 200, 1];208;ארהב;42529;(3, 13, 56, 8, 42529);הכבס;3;(3, 13, 56, 28, 161023);ואם ראה הכהן והנה כהה הנגע אחרי הכבס אתו וקרע אתו מן הבגד או מן העור או מן השתי או מן הערב
(280080, -64, 4);[2, 5, 200, 1];208;ארהב;73481;(5, 18, 20, 6, 73481);דבר;2;(5, 18, 20, 20, 280080);אך הנביא אשר יזיד לדבר דבר בשמי את אשר לא צויתיו לדבר ואשר ידבר בשם אלהים אחרים ומת הנביא ההוא
(18931, -63, 4);[2, 5, 200, 1];208;ארהב;5077;(1, 16, 13, 4, 5077);הדבר;3;(1, 16, 13, 14, 18931);ותקרא שם יהוה הדבר אליה אתה אל ראי כי אמרה הגם הלם ראיתי אחרי ראי
(148797, -63, 4);[2, 5, 200, 1];208;ארהב;39254;(3, 6, 20, 4, 39254);בבשרה;1;(3, 6, 20, 9, 148797);כל אשר יגע בבשרה יקדש ואשר יזה מדמה על הבגד אשר יזה עליה תכבס במקום קדש
(172746, -63, 4);[2, 5, 200, 1];208;ארהב;45714;(3, 20, 16, 17, 45714);בם;1;(3, 20, 16, 60, 172746);ואשה אשר תקרב אל כל בהמה לרבעה אתה והרגת את האשה ואת הבהמה מות יומתו דמיהם בם
(223795, -63, 4);[2, 5, 200, 1];208;ארהב;59007;(4, 21, 7, 1, 59007);ויבא;3;(4, 21, 7, 3, 223795);ויבא העם אל משה ויאמרו חטאנו כי דברנו ביהוה ובך התפלל אל יהוה ויסר מעלינו את הנחש ויתפלל משה בעד העם
(259741, -63, 4);[2, 5, 200, 1];208;ארהב;68223;(5, 5, 6, 8, 68223);מבית;2;(5, 5, 6, 34, 259741);אנכי יהוה אלהיך אשר הוצאתיך מארץ מצרים מבית עבדים
(10824, -62, 4);[2, 5, 200, 1];208;ארהב;2912;(1, 9, 12, 10, 2912);וביניכם;2;(1, 9, 12, 36, 10824);ויאמר אלהים זאת אות הברית אשר אני נתן ביני וביניכם ובין כל נפש חיה אשר אתכם לדרת עולם
(18146, -62, 4);[2, 5, 200, 1];208;ארהב;4867;(1, 15, 18, 7, 4867);ברית;1;(1, 15, 18, 22, 18146);ביום ההוא כרת יהוה את אברם ברית לאמר לזרעך נתתי את הארץ הזאת מנהר מצרים עד הנהר הגדל נהר פרת
(33437, -62, 4);[2, 5, 200, 1];208;ארהב;8912;(1, 25, 13, 9, 8912);נבית;2;(1, 25, 13, 40, 33437);ואלה שמות בני ישמעאל בשמתם לתולדתם בכר ישמעאל נבית וקדר ואדבאל ומבשם
(39225, -62, 4);[2, 5, 200, 1];208;ארהב;10432;(1, 28, 12, 14, 10432);בו;1;(1, 28, 12, 59, 39225);ויחלם והנה סלם מצב ארצה וראשו מגיע השמימה והנה מלאכי אלהים עלים וירדים בו
(91160, -62, 4);[2, 5, 200, 1];208;ארהב;24029;(2, 9, 28, 8, 24029);וברד;2;(2, 9, 28, 29, 91160);העתירו אל יהוה ורב מהית קלת אלהים וברד ואשלחה אתכם ולא תספון לעמד
(142369, -62, 4);[2, 5, 200, 1];208;ארהב;37532;(3, 1, 15, 1, 37532);והקריבו;6;(3, 1, 15, 6, 142369);והקריבו הכהן אל המזבח ומלק את ראשו והקטיר המזבחה ונמצה דמו על קיר המזבח
(282142, -62, 4);[2, 5, 200, 1];208;ארהב;74043;(5, 20, 13, 4, 74043);בידך;1;(5, 20, 13, 15, 282142);ונתנה יהוה אלהיך בידך והכית את כל זכורה לפי חרב
(292438, -62, 4);[2, 5, 200, 1];208;ארהב;76781;(5, 28, 19, 3, 76781);בבאך;2;(5, 28, 19, 9, 292438);ארור אתה בבאך וארור אתה בצאתך
(297717, -62, 4);[2, 5, 200, 1];208;ארהב;78135;(5, 30, 10, 20, 78135);ובכל;2;(5, 30, 10, 79, 297717);כי תשמע בקול יהוה אלהיך לשמר מצותיו וחקתיו הכתובה בספר התורה הזה כי תשוב אל יהוה אלהיך בכל לבבך ובכל נפשך
(76540, -61, 4);[2, 5, 200, 1];208;ארהב;20211;(1, 49, 31, 13, 20211);רבקה;2;(1, 49, 31, 42, 76540);שמה קברו את אברהם ואת שרה אשתו שמה קברו את יצחק ואת רבקה אשתו ושמה קברתי את לאה
(184694, -61, 4);[2, 5, 200, 1];208;ארהב;48818;(3, 27, 1, 1, 48818);וידבר;4;(3, 27, 1, 4, 184694);וידבר יהוה אל משה לאמר
(199086, -61, 4);[2, 5, 200, 1];208;ארהב;52497;(4, 7, 17, 1, 52497);ולזבח;4;(4, 7, 17, 4, 199086);ולזבח השלמים בקר שנים אילם חמשה עתודים חמשה כבשים בני שנה חמשה זה קרבן נחשון בן עמינדב
(242158, -61, 4);[2, 5, 200, 1];208;ארהב;63711;(4, 32, 3, 9, 63711);ובען;2;(4, 32, 3, 42, 242158);עטרות ודיבן ויעזר ונמרה וחשבון ואלעלה ושבם ונבו ובען
(17383, -60, 4);[2, 5, 200, 1];208;ארהב;4660;(1, 15, 1, 18, 4660);הרבה;3;(1, 15, 1, 64, 17383);אחר הדברים האלה היה דבר יהוה אל אברם במחזה לאמר אל תירא אברם אנכי מגן לך שכרך הרבה מאד
(27776, -60, 4);[2, 5, 200, 1];208;ארהב;7412;(1, 22, 13, 10, 7412);בסבך;3;(1, 22, 13, 37, 27776);וישא אברהם את עיניו וירא והנה איל אחר נאחז בסבך בקרניו וילך אברהם ויקח את האיל ויעלהו לעלה תחת בנו
(55706, -60, 4);[2, 5, 200, 1];208;ארהב;14811;(1, 37, 30, 10, 14811);בא;1;(1, 37, 30, 35, 55706);וישב אל אחיו ויאמר הילד איננו ואני אנה אני בא
(74124, -60, 4);[2, 5, 200, 1];208;ארהב;19582;(1, 48, 5, 3, 19582);בניך;1;(1, 48, 5, 8, 74124);ועתה שני בניך הנולדים לך בארץ מצרים עד באי אליך מצרימה לי הם אפרים ומנשה כראובן ושמעון יהיו לי
(87251, -60, 4);[2, 5, 200, 1];208;ארהב;23005;(2, 7, 18, 5, 23005);ובאש;2;(2, 7, 18, 18, 87251);והדגה אשר ביאר תמות ובאש היאר ונלאו מצרים לשתות מים מן היאר
(124131, -60, 4);[2, 5, 200, 1];208;ארהב;32731;(2, 30, 22, 1, 32731);וידבר;4;(2, 30, 22, 4, 124131);וידבר יהוה אל משה לאמר
(164508, -60, 4);[2, 5, 200, 1];208;ארהב;43477;(3, 15, 5, 11, 43477);הערב;4;(3, 15, 5, 43, 164508);ואיש אשר יגע במשכבו יכבס בגדיו ורחץ במים וטמא עד הערב
(177663, -60, 4);[2, 5, 200, 1];208;ארהב;47033;(3, 23, 29, 7, 47033);בעצם;1;(3, 23, 29, 18, 177663);כי כל הנפש אשר לא תענה בעצם היום הזה ונכרתה מעמיה
(212670, -60, 4);[2, 5, 200, 1];208;ארהב;56064;(4, 14, 34, 1, 56064);במספר;1;(4, 14, 34, 1, 212670);במספר הימים אשר תרתם את הארץ ארבעים יום יום לשנה יום לשנה תשאו את עונתיכם ארבעים שנה וידעתם את תנואתי
(280241, -60, 4);[2, 5, 200, 1];208;ארהב;73525;(5, 18, 22, 19, 73525);הנביא;3;(5, 18, 22, 68, 280241);אשר ידבר הנביא בשם יהוה ולא יהיה הדבר ולא יבא הוא הדבר אשר לא דברו יהוה בזדון דברו הנביא לא תגור ממנו
(280464, -60, 4);[2, 5, 200, 1];208;ארהב;73585;(5, 19, 4, 12, 73585);בבלי;2;(5, 19, 4, 37, 280464);וזה דבר הרצח אשר ינוס שמה וחי אשר יכה את רעהו בבלי דעת והוא לא שנא לו מתמל שלשם
(21893, -59, 4);[2, 5, 200, 1];208;ארהב;5844;(1, 18, 29, 3, 5844);לדבר;3;(1, 18, 29, 10, 21893);ויסף עוד לדבר אליו ויאמר אולי ימצאון שם ארבעים ויאמר לא אעשה בעבור הארבעים
(71173, -59, 4);[2, 5, 200, 1];208;ארהב;18818;(1, 46, 20, 9, 18818);בת;1;(1, 46, 20, 33, 71173);ויולד ליוסף בארץ מצרים אשר ילדה לו אסנת בת פוטי פרע כהן אן את מנשה ואת אפרים
(74179, -59, 4);[2, 5, 200, 1];208;ארהב;19595;(1, 48, 5, 16, 19595);כראובן;5;(1, 48, 5, 63, 74179);ועתה שני בניך הנולדים לך בארץ מצרים עד באי אליך מצרימה לי הם אפרים ומנשה כראובן ושמעון יהיו לי
(92452, -59, 4);[2, 5, 200, 1];208;ארהב;24378;(2, 10, 13, 24, 24378);הארבה;4;(2, 10, 13, 84, 92452);ויט משה את מטהו על ארץ מצרים ויהוה נהג רוח קדים בארץ כל היום ההוא וכל הלילה הבקר היה ורוח הקדים נשא את הארבה
(135625, -59, 4);[2, 5, 200, 1];208;ארהב;35768;(2, 37, 19, 2, 35768);גבעים;2;(2, 37, 19, 6, 135625);שלשה גבעים משקדים בקנה האחד כפתר ופרח ושלשה גבעים משקדים בקנה אחד כפתר ופרח כן לששת הקנים היצאים מן המנרה
(211550, -59, 4);[2, 5, 200, 1];208;ארהב;55766;(4, 14, 12, 2, 55766);בדבר;1;(4, 14, 12, 5, 211550);אכנו בדבר ואורשנו ואעשה אתך לגוי גדול ועצום ממנו
(278883, -59, 4);[2, 5, 200, 1];208;ארהב;73162;(5, 17, 17, 9, 73162);וזהב;4;(5, 17, 17, 32, 278883);ולא ירבה לו נשים ולא יסור לבבו וכסף וזהב לא ירבה לו מאד
(44326, -58, 4);[2, 5, 200, 1];208;ארהב;11809;(1, 31, 14, 10, 11809);בבית;1;(1, 31, 14, 36, 44326);ותען רחל ולאה ותאמרנה לו העוד לנו חלק ונחלה בבית אבינו
(75644, -58, 4);[2, 5, 200, 1];208;ארהב;19974;(1, 49, 10, 6, 19974);מבין;2;(1, 49, 10, 22, 75644);לא יסור שבט מיהודה ומחקק מבין רגליו עד כי יבא שילה ולו יקהת עמים
(89477, -58, 4);[2, 5, 200, 1];208;ארהב;23571;(2, 8, 25, 25, 23571);לזבח;3;(2, 8, 25, 92, 89477);ויאמר משה הנה אנכי יוצא מעמך והעתרתי אל יהוה וסר הערב מפרעה מעבדיו ומעמו מחר רק אל יסף פרעה התל לבלתי שלח את העם לזבח ליהוה
(90942, -58, 4);[2, 5, 200, 1];208;ארהב;23969;(2, 9, 24, 13, 23969);בכל;1;(2, 9, 24, 43, 90942);ויהי ברד ואש מתלקחת בתוך הברד כבד מאד אשר לא היה כמהו בכל ארץ מצרים מאז היתה לגוי
(165244, -58, 4);[2, 5, 200, 1];208;ארהב;43681;(3, 15, 20, 9, 43681);תשב;3;(3, 15, 20, 32, 165244);וכל אשר תשכב עליו בנדתה יטמא וכל אשר תשב עליו יטמא
(184678, -58, 4);[2, 5, 200, 1];208;ארהב;48814;(3, 26, 46, 12, 48814);בהר;1;(3, 26, 46, 49, 184678);אלה החקים והמשפטים והתורת אשר נתן יהוה בינו ובין בני ישראל בהר סיני ביד משה
(184685, -58, 4);[2, 5, 200, 1];208;ארהב;48816;(3, 26, 46, 14, 48816);ביד;1;(3, 26, 46, 56, 184685);אלה החקים והמשפטים והתורת אשר נתן יהוה בינו ובין בני ישראל בהר סיני ביד משה
(185867, -58, 4);[2, 5, 200, 1];208;ארהב;49133;(3, 27, 24, 2, 49133);היובל;4;(3, 27, 24, 8, 185867);בשנת היובל ישוב השדה לאשר קנהו מאתו לאשר לו אחזת הארץ
(185957, -58, 4);[2, 5, 200, 1];208;ארהב;49157;(3, 27, 26, 6, 49157);בבהמה;2;(3, 27, 26, 20, 185957);אך בכור אשר יבכר ליהוה בבהמה לא יקדיש איש אתו אם שור אם שה ליהוה הוא
(226498, -58, 4);[2, 5, 200, 1];208;ארהב;59744;(4, 22, 23, 7, 59744);בדרך;1;(4, 22, 23, 23, 226498);ותרא האתון את מלאך יהוה נצב בדרך וחרבו שלופה בידו ותט האתון מן הדרך ותלך בשדה ויך בלעם את האתון להטתה הדרך
(227504, -58, 4);[2, 5, 200, 1];208;ארהב;60015;(4, 22, 39, 5, 60015);ויבאו;3;(4, 22, 39, 16, 227504);וילך בלעם עם בלק ויבאו קרית חצות
(240502, -58, 4);[2, 5, 200, 1];208;ארהב;63290;(4, 31, 23, 7, 63290);באש;1;(4, 31, 23, 21, 240502);כל דבר אשר יבא באש תעבירו באש וטהר אך במי נדה יתחטא וכל אשר לא יבא באש תעבירו במים
(27517, -57, 4);[2, 5, 200, 1];208;ארהב;7342;(1, 22, 9, 10, 7342);אברהם;2;(1, 22, 9, 34, 27517);ויבאו אל המקום אשר אמר לו האלהים ויבן שם אברהם את המזבח ויערך את העצים ויעקד את יצחק בנו וישם אתו על המזבח ממעל לעצים
(34014, -57, 4);[2, 5, 200, 1];208;ארהב;9057;(1, 25, 26, 7, 9057);בעקב;1;(1, 25, 26, 23, 34014);ואחרי כן יצא אחיו וידו אחזת בעקב עשו ויקרא שמו יעקב ויצחק בן ששים שנה בלדת אתם
(35959, -57, 4);[2, 5, 200, 1];208;ארהב;9557;(1, 26, 29, 14, 9557);בשלום;1;(1, 26, 29, 50, 35959);אם תעשה עמנו רעה כאשר לא נגענוך וכאשר עשינו עמך רק טוב ונשלחך בשלום אתה עתה ברוך יהוה
(60930, -57, 4);[2, 5, 200, 1];208;ארהב;16181;(1, 41, 18, 7, 16181);בריאות;1;(1, 41, 18, 21, 60930);והנה מן היאר עלת שבע פרות בריאות בשר ויפת תאר ותרעינה באחו
(99055, -57, 4);[2, 5, 200, 1];208;ארהב;26135;(2, 14, 18, 9, 26135);ובפרשיו;2;(2, 14, 18, 37, 99055);וידעו מצרים כי אני יהוה בהכבדי בפרעה ברכבו ובפרשיו
(107146, -57, 4);[2, 5, 200, 1];208;ארהב;28296;(2, 20, 5, 5, 28296);תעבדם;3;(2, 20, 5, 17, 107146);לא תשתחוה להם ולא תעבדם כי אנכי יהוה אלהיך אל קנא פקד עון אבת על בנים על שלשים ועל רבעים לשנאי
(178176, -57, 4);[2, 5, 200, 1];208;ארהב;47161;(3, 23, 39, 2, 47161);בחמשה;1;(3, 23, 39, 3, 178176);אך בחמשה עשר יום לחדש השביעי באספכם את תבואת הארץ תחגו את חג יהוה שבעת ימים ביום הראשון שבתון וביום השמיני שבתון
(214721, -57, 4);[2, 5, 200, 1];208;ארהב;56600;(4, 15, 31, 2, 56600);דבר;2;(4, 15, 31, 4, 214721);כי דבר יהוה בזה ואת מצותו הפר הכרת תכרת הנפש ההוא עונה בה
(268066, -57, 4);[2, 5, 200, 1];208;ארהב;70342;(5, 10, 12, 25, 70342);ובכל;2;(5, 10, 12, 93, 268066);ועתה ישראל מה יהוה אלהיך שאל מעמך כי אם ליראה את יהוה אלהיך ללכת בכל דרכיו ולאהבה אתו ולעבד את יהוה אלהיך בכל לבבך ובכל נפשך
(279332, -57, 4);[2, 5, 200, 1];208;ארהב;73281;(5, 18, 5, 3, 73281);בחר;1;(5, 18, 5, 5, 279332);כי בו בחר יהוה אלהיך מכל שבטיך לעמד לשרת בשם יהוה הוא ובניו כל הימים
(58220, -56, 4);[2, 5, 200, 1];208;ארהב;15478;(1, 39, 12, 4, 15478);שכבה;3;(1, 39, 12, 19, 58220);ותתפשהו בבגדו לאמר שכבה עמי ויעזב בגדו בידה וינס ויצא החוצה
(229006, -56, 4);[2, 5, 200, 1];208;ארהב;60428;(4, 23, 30, 9, 60428);במזבח;4;(4, 23, 30, 32, 229006);ויעש בלק כאשר אמר בלעם ויעל פר ואיל במזבח
(234801, -56, 4);[2, 5, 200, 1];208;ארהב;61858;(4, 27, 17, 5, 61858);יבא;2;(4, 27, 17, 18, 234801);אשר יצא לפניהם ואשר יבא לפניהם ואשר יוציאם ואשר יביאם ולא תהיה עדת יהוה כצאן אשר אין להם רעה
(9543, -55, 4);[2, 5, 200, 1];208;ארהב;2556;(1, 8, 9, 7, 2556);ותשב;4;(1, 8, 9, 27, 9543);ולא מצאה היונה מנוח לכף רגלה ותשב אליו אל התבה כי מים על פני כל הארץ וישלח ידו ויקחה ויבא אתה אליו אל התבה
(16156, -55, 4);[2, 5, 200, 1];208;ארהב;4333;(1, 14, 2, 18, 4333);בלע;1;(1, 14, 2, 63, 16156);עשו מלחמה את ברע מלך סדם ואת ברשע מלך עמרה שנאב מלך אדמה ושמאבר מלך צביים ומלך בלע היא צער
(18146, -55, 4);[2, 5, 200, 1];208;ארהב;4867;(1, 15, 18, 7, 4867);ברית;1;(1, 15, 18, 22, 18146);ביום ההוא כרת יהוה את אברם ברית לאמר לזרעך נתתי את הארץ הזאת מנהר מצרים עד הנהר הגדל נהר פרת
(46477, -55, 4);[2, 5, 200, 1];208;ארהב;12392;(1, 32, 1, 5, 12392);לבניו;2;(1, 32, 1, 19, 46477);וישכם לבן בבקר וינשק לבניו ולבנותיו ויברך אתהם וילך וישב לבן למקמו
(63663, -55, 4);[2, 5, 200, 1];208;ארהב;16901;(1, 42, 15, 1, 16901);בזאת;1;(1, 42, 15, 1, 63663);בזאת תבחנו חי פרעה אם תצאו מזה כי אם בבוא אחיכם הקטן הנה
(140178, -55, 4);[2, 5, 200, 1];208;ארהב;36938;(2, 40, 6, 3, 36938);מזבח;3;(2, 40, 6, 10, 140178);ונתתה את מזבח העלה לפני פתח משכן אהל מועד
(239042, -55, 4);[2, 5, 200, 1];208;ארהב;62892;(4, 30, 11, 10, 62892);בשבעה;3;(4, 30, 11, 32, 239042);ואם בית אישה נדרה או אסרה אסר על נפשה בשבעה
(292636, -55, 4);[2, 5, 200, 1];208;ארהב;76832;(5, 28, 22, 9, 76832);ובירקון;2;(5, 28, 22, 45, 292636);יככה יהוה בשחפת ובקדחת ובדלקת ובחרחר ובחרב ובשדפון ובירקון ורדפוך עד אבדך
(18143, -54, 4);[2, 5, 200, 1];208;ארהב;4866;(1, 15, 18, 6, 4866);אברם;2;(1, 15, 18, 19, 18143);ביום ההוא כרת יהוה את אברם ברית לאמר לזרעך נתתי את הארץ הזאת מנהר מצרים עד הנהר הגדל נהר פרת
(34955, -54, 4);[2, 5, 200, 1];208;ארהב;9302;(1, 26, 10, 2, 9302);אבימלך;2;(1, 26, 10, 7, 34955);ויאמר אבימלך מה זאת עשית לנו כמעט שכב אחד העם את אשתך והבאת עלינו אשם
(38705, -54, 4);[2, 5, 200, 1];208;ארהב;10293;(1, 28, 2, 14, 10293);לבן;2;(1, 28, 2, 45, 38705);קום לך פדנה ארם ביתה בתואל אבי אמך וקח לך משם אשה מבנות לבן אחי אמך
(40560, -54, 4);[2, 5, 200, 1];208;ארהב;10795;(1, 29, 15, 3, 10795);ליעקב;5;(1, 29, 15, 13, 40560);ויאמר לבן ליעקב הכי אחי אתה ועבדתני חנם הגידה לי מה משכרתך
(92849, -54, 4);[2, 5, 200, 1];208;ארהב;24488;(2, 10, 20, 9, 24488);בני;1;(2, 10, 20, 26, 92849);ויחזק יהוה את לב פרעה ולא שלח את בני ישראל
