(n,d,k);LetterGematriaNumberValue;Letter;LetterPositionIndex;LetterCoordinatesD5K;Found in Word in Text;LetterPositionIndex In Word;WordNumber;WordCoordinatesDWTK;WordNumberInVerse;Found In Verse
(6164, 79, 5);4;ד;6164;(1, 5, 18, 7, 6164);ירד;3;1643;(1, 5, 18, 2, 1643);2;ויחי ירד שתים וששים שנה ומאת שנה ויולד את חנוך
(6164, 79, 5);6;ו;6243;(1, 5, 20, 1, 6243);ויהיו;1;1664;(1, 5, 20, 1, 1664);1;ויהיו כל ימי ירד שתים וששים שנה ותשע מאות שנה וימת
(6164, 79, 5);50;נ;6322;(1, 5, 22, 8, 6322);חנוך;2;1684;(1, 5, 22, 2, 1684);2;ויתהלך חנוך את האלהים אחרי הולידו את מתושלח שלש מאות שנה ויולד בנים ובנות
(6164, 79, 5);30;ל;6401;(1, 5, 23, 27, 6401);ושלש;3;1704;(1, 5, 23, 8, 1704);8;ויהי כל ימי חנוך חמש וששים שנה ושלש מאות שנה
(6164, 79, 5);4;ד;6480;(1, 5, 25, 34, 6480);ויולד;5;1723;(1, 5, 25, 8, 1723);8;ויחי מתושלח שבע ושמנים שנה ומאת שנה ויולד את למך
