(245801, -12, 4);[2, 5, 200, 1];208;ארהב;64608;(4, 33, 52, 7, 64608);ואבדתם;3;(4, 33, 52, 28, 245801);והורשתם את כל ישבי הארץ מפניכם ואבדתם את כל משכיתם ואת כל צלמי מסכתם תאבדו ואת כל במותם תשמידו
(17558, -11, 4);[2, 5, 200, 1];208;ארהב;4709;(1, 15, 5, 5, 4709);הבט;2;(1, 15, 5, 20, 17558);ויוצא אתו החוצה ויאמר הבט נא השמימה וספר הכוכבים אם תוכל לספר אתם ויאמר לו כה יהיה זרעך
(27332, -11, 4);[2, 5, 200, 1];208;ארהב;7295;(1, 22, 6, 9, 7295);בנו;1;(1, 22, 6, 29, 27332);ויקח אברהם את עצי העלה וישם על יצחק בנו ויקח בידו את האש ואת המאכלת וילכו שניהם יחדו
(65107, -11, 4);[2, 5, 200, 1];208;ארהב;17273;(1, 43, 2, 14, 17273);שברו;2;(1, 43, 2, 55, 65107);ויהי כאשר כלו לאכל את השבר אשר הביאו ממצרים ויאמר אליהם אביהם שבו שברו לנו מעט אכל
(142555, -11, 4);[2, 5, 200, 1];208;ארהב;37580;(3, 2, 1, 3, 37580);תקריב;5;(3, 2, 1, 11, 142555);ונפש כי תקריב קרבן מנחה ליהוה סלת יהיה קרבנו ויצק עליה שמן ונתן עליה לבנה
(154785, -11, 4);[2, 5, 200, 1];208;ארהב;40837;(3, 10, 12, 1, 40837);וידבר;4;(3, 10, 12, 4, 154785);וידבר משה אל אהרן ואל אלעזר ואל איתמר בניו הנותרים קחו את המנחה הנותרת מאשי יהוה ואכלוה מצות אצל המזבח כי קדש קדשים הוא
(182178, -11, 4);[2, 5, 200, 1];208;ארהב;48209;(3, 25, 53, 8, 48209);בפרך;1;(3, 25, 53, 27, 182178);כשכיר שנה בשנה יהיה עמו לא ירדנו בפרך לעיניך
(228830, -11, 4);[2, 5, 200, 1];208;ארהב;60380;(4, 23, 27, 4, 60380);בלעם;1;(4, 23, 27, 11, 228830);ויאמר בלק אל בלעם לכה נא אקחך אל מקום אחר אולי יישר בעיני האלהים וקבתו לי משם
(264741, -11, 4);[2, 5, 200, 1];208;ארהב;69498;(5, 8, 10, 9, 69498);הטבה;3;(5, 8, 10, 35, 264741);ואכלת ושבעת וברכת את יהוה אלהיך על הארץ הטבה אשר נתן לך
(276913, -11, 4);[2, 5, 200, 1];208;ארהב;72637;(5, 16, 7, 10, 72637);בבקר;2;(5, 16, 7, 40, 276913);ובשלת ואכלת במקום אשר יבחר יהוה אלהיך בו ופנית בבקר והלכת לאהליך
(302329, -11, 4);[2, 5, 200, 1];208;ארהב;79324;(5, 32, 44, 13, 79324);בן;1;(5, 32, 44, 46, 302329);ויבא משה וידבר את כל דברי השירה הזאת באזני העם הוא והושע בן נון
(7376, -10, 4);[2, 5, 200, 1];208;ארהב;1971;(1, 6, 12, 10, 1971);בשר;1;(1, 6, 12, 34, 7376);וירא אלהים את הארץ והנה נשחתה כי השחית כל בשר את דרכו על הארץ
(20250, -10, 4);[2, 5, 200, 1];208;ארהב;5417;(1, 17, 23, 5, 5417);בנו;1;(1, 17, 23, 18, 20250);ויקח אברהם את ישמעאל בנו ואת כל ילידי ביתו ואת כל מקנת כספו כל זכר באנשי בית אברהם וימל את בשר ערלתם בעצם היום הזה כאשר דבר אתו אלהים
(61321, -10, 4);[2, 5, 200, 1];208;ארהב;16275;(1, 41, 26, 1, 16275);שבע;2;(1, 41, 26, 2, 61321);שבע פרת הטבת שבע שנים הנה ושבע השבלים הטבת שבע שנים הנה חלום אחד הוא
(63896, -10, 4);[2, 5, 200, 1];208;ארהב;16963;(1, 42, 19, 13, 16963);רעבון;3;(1, 42, 19, 49, 63896);אם כנים אתם אחיכם אחד יאסר בבית משמרכם ואתם לכו הביאו שבר רעבון בתיכם
(110121, -10, 4);[2, 5, 200, 1];208;ארהב;29139;(2, 22, 8, 24, 29139);דבר;2;(2, 22, 8, 66, 110121);על כל דבר פשע על שור על חמור על שה על שלמה על כל אבדה אשר יאמר כי הוא זה עד האלהים יבא דבר שניהם אשר ירשיען אלהים ישלם שנים לרעהו
(131557, -10, 4);[2, 5, 200, 1];208;ארהב;34737;(2, 35, 15, 2, 34737);מזבח;3;(2, 35, 15, 6, 131557);ואת מזבח הקטרת ואת בדיו ואת שמן המשחה ואת קטרת הסמים ואת מסך הפתח לפתח המשכן
(160839, -10, 4);[2, 5, 200, 1];208;ארהב;42478;(3, 13, 53, 8, 42478);בבגד;1;(3, 13, 53, 25, 160839);ואם יראה הכהן והנה לא פשה הנגע בבגד או בשתי או בערב או בכל כלי עור
(214863, -10, 4);[2, 5, 200, 1];208;ארהב;56637;(4, 15, 34, 3, 56637);במשמר;1;(4, 15, 34, 10, 214863);ויניחו אתו במשמר כי לא פרש מה יעשה לו
(227362, -10, 4);[2, 5, 200, 1];208;ארהב;59975;(4, 22, 37, 2, 59975);בלק;1;(4, 22, 37, 6, 227362);ויאמר בלק אל בלעם הלא שלח שלחתי אליך לקרא לך למה לא הלכת אלי האמנם לא אוכל כבדך
(264275, -10, 4);[2, 5, 200, 1];208;ארהב;69374;(5, 8, 2, 10, 69374);ארבעים;3;(5, 8, 2, 36, 264275);וזכרת את כל הדרך אשר הוליכך יהוה אלהיך זה ארבעים שנה במדבר למען ענתך לנסתך לדעת את אשר בלבבך התשמר מצותו אם לא
(274011, -10, 4);[2, 5, 200, 1];208;ארהב;71863;(5, 14, 5, 2, 71863);וצבי;3;(5, 14, 5, 6, 274011);איל וצבי ויחמור ואקו ודישן ותאו וזמר
(277910, -10, 4);[2, 5, 200, 1];208;ארהב;72896;(5, 17, 2, 22, 72896);בריתו;1;(5, 17, 2, 76, 277910);כי ימצא בקרבך באחד שעריך אשר יהוה אלהיך נתן לך איש או אשה אשר יעשה את הרע בעיני יהוה אלהיך לעבר בריתו
(107878, -9, 4);[2, 5, 200, 1];208;ארהב;28499;(2, 20, 19, 8, 28499);בני;1;(2, 20, 19, 23, 107878);ויאמר יהוה אל משה כה תאמר אל בני ישראל אתם ראיתם כי מן השמים דברתי עמכם
(195265, -9, 4);[2, 5, 200, 1];208;ארהב;51478;(4, 5, 2, 3, 51478);בני;1;(4, 5, 2, 5, 195265);צו את בני ישראל וישלחו מן המחנה כל צרוע וכל זב וכל טמא לנפש
(292606, -9, 4);[2, 5, 200, 1];208;ארהב;76827;(5, 28, 22, 4, 76827);ובקדחת;2;(5, 28, 22, 15, 292606);יככה יהוה בשחפת ובקדחת ובדלקת ובחרחר ובחרב ובשדפון ובירקון ורדפוך עד אבדך
(302582, -9, 4);[2, 5, 200, 1];208;ארהב;79396;(5, 32, 49, 9, 79396);בארץ;1;(5, 32, 49, 25, 302582);עלה אל הר העברים הזה הר נבו אשר בארץ מואב אשר על פני ירחו וראה את ארץ כנען אשר אני נתן לבני ישראל לאחזה
(7018, -8, 4);[2, 5, 200, 1];208;ארהב;1870;(1, 6, 4, 14, 1870);בנות;1;(1, 6, 4, 49, 7018);הנפלים היו בארץ בימים ההם וגם אחרי כן אשר יבאו בני האלהים אל בנות האדם וילדו להם המה הגברים אשר מעולם אנשי השם
(34782, -8, 4);[2, 5, 200, 1];208;ארהב;9257;(1, 26, 7, 17, 9257);רבקה;2;(1, 26, 7, 66, 34782);וישאלו אנשי המקום לאשתו ויאמר אחתי הוא כי ירא לאמר אשתי פן יהרגני אנשי המקום על רבקה כי טובת מראה הוא
(57685, -8, 4);[2, 5, 200, 1];208;ארהב;15332;(1, 39, 3, 12, 15332);בידו;1;(1, 39, 3, 40, 57685);וירא אדניו כי יהוה אתו וכל אשר הוא עשה יהוה מצליח בידו
(82069, -8, 4);[2, 5, 200, 1];208;ארהב;21643;(2, 4, 5, 8, 21643);אבתם;2;(2, 4, 5, 30, 82069);למען יאמינו כי נראה אליך יהוה אלהי אבתם אלהי אברהם אלהי יצחק ואלהי יעקב
(157566, -8, 4);[2, 5, 200, 1];208;ארהב;41585;(3, 11, 47, 9, 41585);ובין;2;(3, 11, 47, 37, 157566);להבדיל בין הטמא ובין הטהר ובין החיה הנאכלת ובין החיה אשר לא תאכל
(222567, -8, 4);[2, 5, 200, 1];208;ארהב;58681;(4, 20, 13, 3, 58681);מריבה;4;(4, 20, 13, 9, 222567);המה מי מריבה אשר רבו בני ישראל את יהוה ויקדש בם
(229645, -8, 4);[2, 5, 200, 1];208;ארהב;60595;(4, 24, 13, 16, 60595);טובה;3;(4, 24, 13, 50, 229645);אם יתן לי בלק מלא ביתו כסף וזהב לא אוכל לעבר את פי יהוה לעשות טובה או רעה מלבי אשר ידבר יהוה אתו אדבר
(231472, -8, 4);[2, 5, 200, 1];208;ארהב;61066;(4, 26, 9, 17, 61066);בעדת;1;(4, 26, 9, 64, 231472);ובני אליאב נמואל ודתן ואבירם הוא דתן ואבירם קרואי העדה אשר הצו על משה ועל אהרן בעדת קרח בהצתם על יהוה
(280179, -8, 4);[2, 5, 200, 1];208;ארהב;73508;(5, 18, 22, 2, 73508);ידבר;3;(5, 18, 22, 6, 280179);אשר ידבר הנביא בשם יהוה ולא יהיה הדבר ולא יבא הוא הדבר אשר לא דברו יהוה בזדון דברו הנביא לא תגור ממנו
(296463, -8, 4);[2, 5, 200, 1];208;ארהב;77818;(5, 29, 19, 18, 77818);הכתובה;5;(5, 29, 19, 61, 296463);לא יאבה יהוה סלח לו כי אז יעשן אף יהוה וקנאתו באיש ההוא ורבצה בו כל האלה הכתובה בספר הזה ומחה יהוה את שמו מתחת השמים
(26085, -7, 4);[2, 5, 200, 1];208;ארהב;6959;(1, 21, 16, 14, 6959);ותשב;4;(1, 21, 16, 51, 26085);ותלך ותשב לה מנגד הרחק כמטחוי קשת כי אמרה אל אראה במות הילד ותשב מנגד ותשא את קלה ותבך
(29991, -7, 4);[2, 5, 200, 1];208;ארהב;8013;(1, 24, 12, 5, 8013);אברהם;2;(1, 24, 12, 19, 29991);ויאמר יהוה אלהי אדני אברהם הקרה נא לפני היום ועשה חסד עם אדני אברהם
(50692, -7, 4);[2, 5, 200, 1];208;ארהב;13512;(1, 34, 30, 10, 13512);בישב;1;(1, 34, 30, 39, 50692);ויאמר יעקב אל שמעון ואל לוי עכרתם אתי להבאישני בישב הארץ בכנעני ובפרזי ואני מתי מספר ונאספו עלי והכוני ונשמדתי אני וביתי
(67670, -7, 4);[2, 5, 200, 1];208;ארהב;17905;(1, 44, 14, 1, 17905);ויבא;3;(1, 44, 14, 3, 67670);ויבא יהודה ואחיו ביתה יוסף והוא עודנו שם ויפלו לפניו ארצה
(158047, -7, 4);[2, 5, 200, 1];208;ארהב;41718;(3, 13, 2, 5, 41718);בשרו;1;(3, 13, 2, 14, 158047);אדם כי יהיה בעור בשרו שאת או ספחת או בהרת והיה בעור בשרו לנגע צרעת והובא אל אהרן הכהן או אל אחד מבניו הכהנים
(184416, -7, 4);[2, 5, 200, 1];208;ארהב;48750;(3, 26, 43, 2, 48750);תעזב;4;(3, 26, 43, 9, 184416);והארץ תעזב מהם ותרץ את שבתתיה בהשמה מהם והם ירצו את עונם יען וביען במשפטי מאסו ואת חקתי געלה נפשם
(240088, -7, 4);[2, 5, 200, 1];208;ארהב;63177;(4, 31, 14, 11, 63177);מצבא;3;(4, 31, 14, 45, 240088);ויקצף משה על פקודי החיל שרי האלפים ושרי המאות הבאים מצבא המלחמה
(9832, -6, 4);[2, 5, 200, 1];208;ארהב;2637;(1, 8, 14, 1, 2637);ובחדש;2;(1, 8, 14, 2, 9832);ובחדש השני בשבעה ועשרים יום לחדש יבשה הארץ
(32024, -6, 4);[2, 5, 200, 1];208;ארהב;8552;(1, 24, 50, 7, 8552);הדבר;3;(1, 24, 50, 30, 32024);ויען לבן ובתואל ויאמרו מיהוה יצא הדבר לא נוכל דבר אליך רע או טוב
(38117, -6, 4);[2, 5, 200, 1];208;ארהב;10131;(1, 27, 38, 9, 10131);אבי;2;(1, 27, 38, 29, 38117);ויאמר עשו אל אביו הברכה אחת הוא לך אבי ברכני גם אני אבי וישא עשו קלו ויבך
(58472, -6, 4);[2, 5, 200, 1];208;ארהב;15542;(1, 39, 17, 9, 15542);העברי;3;(1, 39, 17, 35, 58472);ותדבר אליו כדברים האלה לאמר בא אלי העבד העברי אשר הבאת לנו לצחק בי
(63251, -6, 4);[2, 5, 200, 1];208;ארהב;16797;(1, 42, 6, 11, 16797);ויבאו;3;(1, 42, 6, 40, 63251);ויוסף הוא השליט על הארץ הוא המשביר לכל עם הארץ ויבאו אחי יוסף וישתחוו לו אפים ארצה
(119650, -6, 4);[2, 5, 200, 1];208;ארהב;31564;(2, 28, 28, 4, 31564);מטבעתו;3;(2, 28, 28, 15, 119650);וירכסו את החשן מטבעתו אל טבעת האפוד בפתיל תכלת להיות על חשב האפוד ולא יזח החשן מעל האפוד
(140424, -6, 4);[2, 5, 200, 1];208;ארהב;37008;(2, 40, 12, 5, 37008);בניו;1;(2, 40, 12, 16, 140424);והקרבת את אהרן ואת בניו אל פתח אהל מועד ורחצת אתם במים
(222768, -6, 4);[2, 5, 200, 1];208;ארהב;58730;(4, 20, 16, 12, 58730);בקדש;1;(4, 20, 16, 51, 222768);ונצעק אל יהוה וישמע קלנו וישלח מלאך ויצאנו ממצרים והנה אנחנו בקדש עיר קצה גבולך
(243468, -6, 4);[2, 5, 200, 1];208;ארהב;64045;(4, 32, 29, 5, 64045);יעברו;3;(4, 32, 29, 17, 243468);ויאמר משה אלהם אם יעברו בני גד ובני ראובן אתכם את הירדן כל חלוץ למלחמה לפני יהוה ונכבשה הארץ לפניכם ונתתם להם את ארץ הגלעד לאחזה
(251319, -6, 4);[2, 5, 200, 1];208;ארהב;66039;(5, 1, 25, 2, 66039);בידם;1;(5, 1, 25, 6, 251319);ויקחו בידם מפרי הארץ ויורדו אלינו וישבו אתנו דבר ויאמרו טובה הארץ אשר יהוה אלהינו נתן לנו
(256020, -6, 4);[2, 5, 200, 1];208;ארהב;67266;(5, 3, 25, 8, 67266);בעבר;3;(5, 3, 25, 29, 256020);אעברה נא ואראה את הארץ הטובה אשר בעבר הירדן ההר הטוב הזה והלבנן
(256033, -6, 4);[2, 5, 200, 1];208;ארהב;67269;(5, 3, 25, 11, 67269);הטוב;4;(5, 3, 25, 42, 256033);אעברה נא ואראה את הארץ הטובה אשר בעבר הירדן ההר הטוב הזה והלבנן
(299167, -6, 4);[2, 5, 200, 1];208;ארהב;78503;(5, 31, 13, 1, 78503);ובניהם;2;(5, 31, 13, 2, 299167);ובניהם אשר לא ידעו ישמעו ולמדו ליראה את יהוה אלהיכם כל הימים אשר אתם חיים על האדמה אשר אתם עברים את הירדן שמה לרשתה
(67902, -5, 4);[2, 5, 200, 1];208;ארהב;17965;(1, 44, 17, 10, 17965);בידו;1;(1, 44, 17, 37, 67902);ויאמר חלילה לי מעשות זאת האיש אשר נמצא הגביע בידו הוא יהיה לי עבד ואתם עלו לשלום אל אביכם
(85510, -5, 4);[2, 5, 200, 1];208;ארהב;22553;(2, 6, 14, 3, 22553);בית;1;(2, 6, 14, 8, 85510);אלה ראשי בית אבתם בני ראובן בכר ישראל חנוך ופלוא חצרן וכרמי אלה משפחת ראובן
(104276, -5, 4);[2, 5, 200, 1];208;ארהב;27509;(2, 18, 4, 7, 27509);בעזרי;1;(2, 18, 4, 23, 104276);ושם האחד אליעזר כי אלהי אבי בעזרי ויצלני מחרב פרעה
(131225, -5, 4);[2, 5, 200, 1];208;ארהב;34651;(2, 35, 5, 12, 34651);זהב;3;(2, 35, 5, 46, 131225);קחו מאתכם תרומה ליהוה כל נדיב לבו יביאה את תרומת יהוה זהב וכסף ונחשת
(227211, -5, 4);[2, 5, 200, 1];208;ארהב;59933;(4, 22, 34, 18, 59933);בעיניך;1;(4, 22, 34, 60, 227211);ויאמר בלעם אל מלאך יהוה חטאתי כי לא ידעתי כי אתה נצב לקראתי בדרך ועתה אם רע בעיניך אשובה לי
(243858, -5, 4);[2, 5, 200, 1];208;ארהב;64146;(4, 32, 36, 2, 64146);בית;1;(4, 32, 36, 4, 243858);ואת בית נמרה ואת בית הרן ערי מבצר וגדרת צאן
(254351, -5, 4);[2, 5, 200, 1];208;ארהב;66823;(5, 2, 35, 3, 66823);בזזנו;1;(5, 2, 35, 8, 254351);רק הבהמה בזזנו לנו ושלל הערים אשר לכדנו
(7459, -4, 4);[2, 5, 200, 1];208;ארהב;1995;(1, 6, 14, 3, 1995);תבת;2;(1, 6, 14, 7, 7459);עשה לך תבת עצי גפר קנים תעשה את התבה וכפרת אתה מבית ומחוץ בכפר
(79238, -4, 4);[2, 5, 200, 1];208;ארהב;20914;(2, 2, 5, 15, 20914);בתוך;1;(2, 2, 5, 50, 79238);ותרד בת פרעה לרחץ על היאר ונערתיה הלכת על יד היאר ותרא את התבה בתוך הסוף ותשלח את אמתה ותקחה
(92812, -4, 4);[2, 5, 200, 1];208;ארהב;24477;(2, 10, 19, 17, 24477);בכל;1;(2, 10, 19, 58, 92812);ויהפך יהוה רוח ים חזק מאד וישא את הארבה ויתקעהו ימה סוף לא נשאר ארבה אחד בכל גבול מצרים
(110185, -4, 4);[2, 5, 200, 1];208;ארהב;29158;(2, 22, 9, 12, 29158);בהמה;1;(2, 22, 9, 31, 110185);כי יתן איש אל רעהו חמור או שור או שה וכל בהמה לשמר ומת או נשבר או נשבה אין ראה
(159200, -4, 4);[2, 5, 200, 1];208;ארהב;42025;(3, 13, 24, 2, 42025);בשר;1;(3, 13, 24, 3, 159200);או בשר כי יהיה בערו מכות אש והיתה מחית המכוה בהרת לבנה אדמדמת או לבנה
(171531, -4, 4);[2, 5, 200, 1];208;ארהב;45393;(3, 19, 30, 2, 45393);שבתתי;2;(3, 19, 30, 4, 171531);את שבתתי תשמרו ומקדשי תיראו אני יהוה
(269611, -4, 4);[2, 5, 200, 1];208;ארהב;70737;(5, 11, 18, 6, 70737);לבבכם;2;(5, 11, 18, 18, 269611);ושמתם את דברי אלה על לבבכם ועל נפשכם וקשרתם אתם לאות על ידכם והיו לטוטפת בין עיניכם
(132414, -3, 4);[2, 5, 200, 1];208;ארהב;34964;(2, 35, 30, 9, 34964);בשם;1;(2, 35, 30, 29, 132414);ויאמר משה אל בני ישראל ראו קרא יהוה בשם בצלאל בן אורי בן חור למטה יהודה
(142680, -3, 4);[2, 5, 200, 1];208;ארהב;37611;(3, 2, 2, 19, 37611);המזבחה;4;(3, 2, 2, 77, 142680);והביאה אל בני אהרן הכהנים וקמץ משם מלא קמצו מסלתה ומשמנה על כל לבנתה והקטיר הכהן את אזכרתה המזבחה אשה ריח ניחח ליהוה
(210098, -3, 4);[2, 5, 200, 1];208;ארהב;55380;(4, 13, 20, 8, 55380);בה;1;(4, 13, 20, 24, 210098);ומה הארץ השמנה הוא אם רזה היש בה עץ אם אין והתחזקתם ולקחתם מפרי הארץ והימים ימי בכורי ענבים
(280230, -3, 4);[2, 5, 200, 1];208;ארהב;73523;(5, 18, 22, 17, 73523);בזדון;1;(5, 18, 22, 57, 280230);אשר ידבר הנביא בשם יהוה ולא יהיה הדבר ולא יבא הוא הדבר אשר לא דברו יהוה בזדון דברו הנביא לא תגור ממנו
(14240, -2, 4);[2, 5, 200, 1];208;ארהב;3816;(1, 12, 3, 2, 3816);מברכיך;2;(1, 12, 3, 8, 14240);ואברכה מברכיך ומקללך אאר ונברכו בך כל משפחת האדמה
(16715, -2, 4);[2, 5, 200, 1];208;ארהב;4478;(1, 14, 13, 5, 4478);העברי;3;(1, 14, 13, 21, 16715);ויבא הפליט ויגד לאברם העברי והוא שכן באלני ממרא האמרי אחי אשכל ואחי ענר והם בעלי ברית אברם
(28131, -2, 4);[2, 5, 200, 1];208;ארהב;7506;(1, 22, 20, 3, 7506);הדברים;3;(1, 22, 20, 11, 28131);ויהי אחרי הדברים האלה ויגד לאברהם לאמר הנה ילדה מלכה גם הוא בנים לנחור אחיך
(30892, -2, 4);[2, 5, 200, 1];208;ארהב;8254;(1, 24, 30, 17, 8254);דבר;2;(1, 24, 30, 60, 30892);ויהי כראת את הנזם ואת הצמדים על ידי אחתו וכשמעו את דברי רבקה אחתו לאמר כה דבר אלי האיש ויבא אל האיש והנה עמד על הגמלים על העין
(54887, -2, 4);[2, 5, 200, 1];208;ארהב;14610;(1, 37, 15, 10, 14610);תבקש;2;(1, 37, 15, 40, 54887);וימצאהו איש והנה תעה בשדה וישאלהו האיש לאמר מה תבקש
(71940, -2, 4);[2, 5, 200, 1];208;ארהב;19020;(1, 47, 1, 13, 19020);באו;1;(1, 47, 1, 49, 71940);ויבא יוסף ויגד לפרעה ויאמר אבי ואחי וצאנם ובקרם וכל אשר להם באו מארץ כנען והנם בארץ גשן
(73891, -2, 4);[2, 5, 200, 1];208;ארהב;19522;(1, 48, 1, 3, 19522);הדברים;3;(1, 48, 1, 11, 73891);ויהי אחרי הדברים האלה ויאמר ליוסף הנה אביך חלה ויקח את שני בניו עמו את מנשה ואת אפרים
(99690, -2, 4);[2, 5, 200, 1];208;ארהב;26295;(2, 14, 28, 13, 26295);בים;1;(2, 14, 28, 51, 99690);וישבו המים ויכסו את הרכב ואת הפרשים לכל חיל פרעה הבאים אחריהם בים לא נשאר בהם עד אחד
(108778, -2, 4);[2, 5, 200, 1];208;ארהב;28744;(2, 21, 18, 8, 28744);באבן;1;(2, 21, 18, 27, 108778);וכי יריבן אנשים והכה איש את רעהו באבן או באגרף ולא ימות ונפל למשכב
(160923, -2, 4);[2, 5, 200, 1];208;ארהב;42501;(3, 13, 55, 4, 42501);הכבס;3;(3, 13, 55, 15, 160923);וראה הכהן אחרי הכבס את הנגע והנה לא הפך הנגע את עינו והנגע לא פשה טמא הוא באש תשרפנו פחתת הוא בקרחתו או בגבחתו
(161023, -2, 4);[2, 5, 200, 1];208;ארהב;42529;(3, 13, 56, 8, 42529);הכבס;3;(3, 13, 56, 28, 161023);ואם ראה הכהן והנה כהה הנגע אחרי הכבס אתו וקרע אתו מן הבגד או מן העור או מן השתי או מן הערב
(198185, -2, 4);[2, 5, 200, 1];208;ארהב;52264;(4, 6, 23, 8, 52264);תברכו;2;(4, 6, 23, 24, 198185);דבר אל אהרן ואל בניו לאמר כה תברכו את בני ישראל אמור להם
(259026, -2, 4);[2, 5, 200, 1];208;ארהב;68037;(5, 4, 42, 8, 68037);בבלי;1;(5, 4, 42, 24, 259026);לנס שמה רוצח אשר ירצח את רעהו בבלי דעת והוא לא שנא לו מתמל שלשם ונס אל אחת מן הערים האל וחי
(268194, -2, 4);[2, 5, 200, 1];208;ארהב;70375;(5, 10, 15, 10, 70375);בכם;1;(5, 10, 15, 41, 268194);רק באבתיך חשק יהוה לאהבה אותם ויבחר בזרעם אחריהם בכם מכל העמים כיום הזה
(278200, -2, 4);[2, 5, 200, 1];208;ארהב;72975;(5, 17, 7, 11, 72975);ובערת;2;(5, 17, 7, 41, 278200);יד העדים תהיה בו בראשנה להמיתו ויד כל העם באחרנה ובערת הרע מקרבך
(280463, -2, 4);[2, 5, 200, 1];208;ארהב;73585;(5, 19, 4, 12, 73585);בבלי;1;(5, 19, 4, 36, 280463);וזה דבר הרצח אשר ינוס שמה וחי אשר יכה את רעהו בבלי דעת והוא לא שנא לו מתמל שלשם
(280502, -2, 4);[2, 5, 200, 1];208;ארהב;73597;(5, 19, 5, 5, 73597);ביער;1;(5, 19, 5, 14, 280502);ואשר יבא את רעהו ביער לחטב עצים ונדחה ידו בגרזן לכרת העץ ונשל הברזל מן העץ ומצא את רעהו ומת הוא ינוס אל אחת הערים האלה וחי
(281931, -2, 4);[2, 5, 200, 1];208;ארהב;73986;(5, 20, 8, 11, 73986);הלבב;3;(5, 20, 8, 41, 281931);ויספו השטרים לדבר אל העם ואמרו מי האיש הירא ורך הלבב ילך וישב לביתו ולא ימס את לבב אחיו כלבבו
(40506, -100, 6);[5, 100, 10, 200, 40, 1];356;אמריקה;10781;(1, 29, 13, 23, 10781);האלה;1;(1, 29, 13, 83, 40506);ויהי כשמע לבן את שמע יעקב בן אחתו וירץ לקראתו ויחבק לו וינשק לו ויביאהו אל ביתו ויספר ללבן את כל הדברים האלה
(175201, -55, 6);[5, 100, 10, 200, 40, 1];356;אמריקה;46403;(3, 22, 13, 13, 46403);אביה;4;(3, 22, 13, 45, 175201);ובת כהן כי תהיה אלמנה וגרושה וזרע אין לה ושבה אל בית אביה כנעוריה מלחם אביה תאכל וכל זר לא יאכל בו
(21882, -1, 10);[300, 40, 8, 6, 40, 10, 70, 2, 200, 1];677;ארבעים וחמש;5841;(1, 18, 28, 18, 5841);וחמשה;4;(1, 18, 28, 74, 21882);אולי יחסרון חמשים הצדיקם חמשה התשחית בחמשה את כל העיר ויאמר לא אשחית אם אמצא שם ארבעים וחמשה
(95539, -72, 7);[5, 40, 1, 10, 300, 50, 5];411;הנשיא מה;25207;(2, 12, 27, 4, 25207);הוא;1;(2, 12, 27, 13, 95539);ואמרתם זבח פסח הוא ליהוה אשר פסח על בתי בני ישראל במצרים בנגפו את מצרים ואת בתינו הציל ויקד העם וישתחוו
(94230, -43, 7);[5, 40, 1, 10, 300, 50, 5];411;הנשיא מה;24870;(2, 12, 6, 9, 24870);הזה;3;(2, 12, 6, 33, 94230);והיה לכם למשמרת עד ארבעה עשר יום לחדש הזה ושחטו אתו כל קהל עדת ישראל בין הערבים
(95539, -72, 6);[5, 40, 1, 10, 300, 50];406;נשיא מה;25207;(2, 12, 27, 4, 25207);הוא;1;(2, 12, 27, 13, 95539);ואמרתם זבח פסח הוא ליהוה אשר פסח על בתי בני ישראל במצרים בנגפו את מצרים ואת בתינו הציל ויקד העם וישתחוו
(196632, -70, 6);[5, 40, 1, 10, 300, 50];406;נשיא מה;51844;(4, 5, 25, 13, 51844);והקריב;2;(4, 5, 25, 48, 196632);ולקח הכהן מיד האשה את מנחת הקנאת והניף את המנחה לפני יהוה והקריב אתה אל המזבח
(94230, -43, 6);[5, 40, 1, 10, 300, 50];406;נשיא מה;24870;(2, 12, 6, 9, 24870);הזה;3;(2, 12, 6, 33, 94230);והיה לכם למשמרת עד ארבעה עשר יום לחדש הזה ושחטו אתו כל קהל עדת ישראל בין הערבים
