(254183, -75, 4);[1, 10, 300, 50];361;נשיא ;66777;(5, 2, 31, 8, 66777);את;1;(5, 2, 31, 28, 254183);ויאמר יהוה אלי ראה החלתי תת לפניך את סיחן ואת ארצו החל רש לרשת את ארצו
(34108, -74, 4);[1, 10, 300, 50];361;נשיא ;9082;(1, 25, 28, 1, 9082);ויאהב;3;(1, 25, 28, 3, 34108);ויאהב יצחק את עשו כי ציד בפיו ורבקה אהבת את יעקב
(45835, -74, 4);[1, 10, 300, 50];361;נשיא ;12221;(1, 31, 42, 22, 12221);אמש;1;(1, 31, 42, 78, 45835);לולי אלהי אבי אלהי אברהם ופחד יצחק היה לי כי עתה ריקם שלחתני את עניי ואת יגיע כפי ראה אלהים ויוכח אמש
(55335, -74, 4);[1, 10, 300, 50];361;נשיא ;14723;(1, 37, 24, 7, 14723);אין;1;(1, 37, 24, 27, 55335);ויקחהו וישלכו אתו הברה והבור רק אין בו מים
(85492, -74, 4);[1, 10, 300, 50];361;נשיא ;22548;(2, 6, 13, 18, 22548);ישראל;4;(2, 6, 13, 66, 85492);וידבר יהוה אל משה ואל אהרן ויצום אל בני ישראל ואל פרעה מלך מצרים להוציא את בני ישראל מארץ מצרים
(229975, -74, 4);[1, 10, 300, 50];361;נשיא ;60681;(4, 24, 20, 7, 60681);ראשית;2;(4, 24, 20, 25, 229975);וירא את עמלק וישא משלו ויאמר ראשית גוים עמלק ואחריתו עדי אבד
(250190, -74, 4);[1, 10, 300, 50];361;נשיא ;65759;(5, 1, 5, 8, 65759);את;1;(5, 1, 5, 29, 250190);בעבר הירדן בארץ מואב הואיל משה באר את התורה הזאת לאמר
(303069, -74, 4);[1, 10, 300, 50];361;נשיא ;79529;(5, 33, 7, 3, 79529);ויאמר;3;(5, 33, 7, 13, 303069);וזאת ליהודה ויאמר שמע יהוה קול יהודה ואל עמו תביאנו ידיו רב לו ועזר מצריו תהיה
(2949, -73, 4);[1, 10, 300, 50];361;נשיא ;774;(1, 3, 1, 12, 774);אל;1;(1, 3, 1, 43, 2949);והנחש היה ערום מכל חית השדה אשר עשה יהוה אלהים ויאמר אל האשה אף כי אמר אלהים לא תאכלו מכל עץ הגן
(27037, -73, 4);[1, 10, 300, 50];361;נשיא ;7215;(1, 22, 2, 6, 7215);את;1;(1, 22, 2, 15, 27037);ויאמר קח נא את בנך את יחידך אשר אהבת את יצחק ולך לך אל ארץ המריה והעלהו שם לעלה על אחד ההרים אשר אמר אליך
(31484, -73, 4);[1, 10, 300, 50];361;נשיא ;8407;(1, 24, 42, 5, 8407);ואמר;2;(1, 24, 42, 16, 31484);ואבא היום אל העין ואמר יהוה אלהי אדני אברהם אם ישך נא מצליח דרכי אשר אנכי הלך עליה
(56984, -73, 4);[1, 10, 300, 50];361;נשיא ;15151;(1, 38, 20, 14, 15151);מצאה;3;(1, 38, 20, 56, 56984);וישלח יהודה את גדי העזים ביד רעהו העדלמי לקחת הערבון מיד האשה ולא מצאה
(102045, -73, 4);[1, 10, 300, 50];361;נשיא ;26911;(2, 16, 15, 6, 26911);אל;1;(2, 16, 15, 23, 102045);ויראו בני ישראל ויאמרו איש אל אחיו מן הוא כי לא ידעו מה הוא ויאמר משה אלהם הוא הלחם אשר נתן יהוה לכם לאכלה
(108600, -73, 4);[1, 10, 300, 50];361;נשיא ;28697;(2, 21, 13, 1, 28697);ואשר;2;(2, 21, 13, 2, 108600);ואשר לא צדה והאלהים אנה לידו ושמתי לך מקום אשר ינוס שמה
(109369, -73, 4);[1, 10, 300, 50];361;נשיא ;28915;(2, 21, 31, 4, 28915);או;1;(2, 21, 31, 8, 109369);או בן יגח או בת יגח כמשפט הזה יעשה לו
(285637, -73, 4);[1, 10, 300, 50];361;נשיא ;74994;(5, 23, 3, 9, 74994);לא;2;(5, 23, 3, 29, 285637);לא יבא ממזר בקהל יהוה גם דור עשירי לא יבא לו בקהל יהוה
(11961, -72, 4);[1, 10, 300, 50];361;נשיא ;3212;(1, 10, 11, 9, 3212);ואת;2;(1, 10, 11, 30, 11961);מן הארץ ההוא יצא אשור ויבן את נינוה ואת רחבת עיר ואת כלח
(49302, -72, 4);[1, 10, 300, 50];361;נשיא ;13138;(1, 34, 3, 7, 13138);את;1;(1, 34, 3, 26, 49302);ותדבק נפשו בדינה בת יעקב ויאהב את הנער וידבר על לב הנער
(88672, -72, 4);[1, 10, 300, 50];361;נשיא ;23367;(2, 8, 13, 22, 23367);ארץ;1;(2, 8, 13, 74, 88672);ויעשו כן ויט אהרן את ידו במטהו ויך את עפר הארץ ותהי הכנם באדם ובבהמה כל עפר הארץ היה כנים בכל ארץ מצרים
(95395, -72, 4);[1, 10, 300, 50];361;נשיא ;25167;(2, 12, 23, 21, 25167);לבא;3;(2, 12, 23, 77, 95395);ועבר יהוה לנגף את מצרים וראה את הדם על המשקוף ועל שתי המזוזת ופסח יהוה על הפתח ולא יתן המשחית לבא אל בתיכם לנגף
(180782, -72, 4);[1, 10, 300, 50];361;נשיא ;47833;(3, 25, 25, 6, 47833);ובא;3;(3, 25, 25, 23, 180782);כי ימוך אחיך ומכר מאחזתו ובא גאלו הקרב אליו וגאל את ממכר אחיו
(204059, -72, 4);[1, 10, 300, 50];361;נשיא ;53795;(4, 9, 6, 7, 53795);אדם;1;(4, 9, 6, 25, 204059);ויהי אנשים אשר היו טמאים לנפש אדם ולא יכלו לעשת הפסח ביום ההוא ויקרבו לפני משה ולפני אהרן ביום ההוא
(233878, -72, 4);[1, 10, 300, 50];361;נשיא ;61610;(4, 26, 64, 4, 61610);איש;1;(4, 26, 64, 11, 233878);ובאלה לא היה איש מפקודי משה ואהרן הכהן אשר פקדו את בני ישראל במדבר סיני
(247555, -72, 4);[1, 10, 300, 50];361;נשיא ;65055;(4, 35, 5, 20, 65055);פאת;2;(4, 35, 5, 71, 247555);ומדתם מחוץ לעיר את פאת קדמה אלפים באמה ואת פאת נגב אלפים באמה ואת פאת ים אלפים באמה ואת פאת צפון אלפים באמה והעיר בתוך זה יהיה להם מגרשי הערים
(289846, -72, 4);[1, 10, 300, 50];361;נשיא ;76106;(5, 26, 13, 22, 76106);ולא;3;(5, 26, 13, 95, 289846);ואמרת לפני יהוה אלהיך בערתי הקדש מן הבית וגם נתתיו ללוי ולגר ליתום ולאלמנה ככל מצותך אשר צויתני לא עברתי ממצותיך ולא שכחתי
(28620, -71, 4);[1, 10, 300, 50];361;נשיא ;7639;(1, 23, 7, 2, 7639);אברהם;1;(1, 23, 7, 5, 28620);ויקם אברהם וישתחו לעם הארץ לבני חת
(92342, -71, 4);[1, 10, 300, 50];361;נשיא ;24346;(2, 10, 12, 16, 24346);את;1;(2, 10, 12, 55, 92342);ויאמר יהוה אל משה נטה ידך על ארץ מצרים בארבה ויעל על ארץ מצרים ויאכל את כל עשב הארץ את כל אשר השאיר הברד
(168334, -71, 4);[1, 10, 300, 50];361;נשיא ;44516;(3, 17, 6, 3, 44516);את;1;(3, 17, 6, 9, 168334);וזרק הכהן את הדם על מזבח יהוה פתח אהל מועד והקטיר החלב לריח ניחח ליהוה
(207213, -71, 4);[1, 10, 300, 50];361;נשיא ;54597;(4, 11, 11, 14, 54597);את;1;(4, 11, 11, 49, 207213);ויאמר משה אל יהוה למה הרעת לעבדך ולמה לא מצתי חן בעיניך לשום את משא כל העם הזה עלי
(6816, -70, 4);[1, 10, 300, 50];361;נשיא ;1814;(1, 5, 32, 13, 1814);ואת;2;(1, 5, 32, 35, 6816);ויהי נח בן חמש מאות שנה ויולד נח את שם את חם ואת יפת
(16338, -70, 4);[1, 10, 300, 50];361;נשיא ;4380;(1, 14, 6, 6, 4380);איל;1;(1, 14, 6, 19, 16338);ואת החרי בהררם שעיר עד איל פארן אשר על המדבר
(45097, -70, 4);[1, 10, 300, 50];361;נשיא ;12021;(1, 31, 30, 8, 12021);אביך;1;(1, 31, 30, 28, 45097);ועתה הלך הלכת כי נכסף נכספתה לבית אביך למה גנבת את אלהי
(67120, -70, 4);[1, 10, 300, 50];361;נשיא ;17769;(1, 44, 2, 9, 17769);ואת;2;(1, 44, 2, 34, 67120);ואת גביעי גביע הכסף תשים בפי אמתחת הקטן ואת כסף שברו ויעש כדבר יוסף אשר דבר
(68930, -70, 4);[1, 10, 300, 50];361;נשיא ;18245;(1, 45, 4, 3, 18245);אל;1;(1, 45, 4, 10, 68930);ויאמר יוסף אל אחיו גשו נא אלי ויגשו ויאמר אני יוסף אחיכם אשר מכרתם אתי מצרימה
(116350, -70, 4);[1, 10, 300, 50];361;נשיא ;30747;(2, 26, 21, 13, 30747);האחד;2;(2, 26, 21, 53, 116350);וארבעים אדניהם כסף שני אדנים תחת הקרש האחד ושני אדנים תחת הקרש האחד
(196492, -70, 4);[1, 10, 300, 50];361;נשיא ;51807;(4, 5, 22, 11, 51807);האשה;2;(4, 5, 22, 47, 196492);ובאו המים המאררים האלה במעיך לצבות בטן ולנפל ירך ואמרה האשה אמן אמן
(64628, -69, 4);[1, 10, 300, 50];361;נשיא ;17150;(1, 42, 33, 7, 17150);אדע;1;(1, 42, 33, 27, 64628);ויאמר אלינו האיש אדני הארץ בזאת אדע כי כנים אתם אחיכם האחד הניחו אתי ואת רעבון בתיכם קחו ולכו
(77034, -69, 4);[1, 10, 300, 50];361;נשיא ;20341;(1, 50, 8, 4, 20341);ואחיו;2;(1, 50, 8, 12, 77034);וכל בית יוסף ואחיו ובית אביו רק טפם וצאנם ובקרם עזבו בארץ גשן
(142916, -69, 4);[1, 10, 300, 50];361;נשיא ;37670;(3, 2, 8, 6, 37670);מאלה;2;(3, 2, 8, 21, 142916);והבאת את המנחה אשר יעשה מאלה ליהוה והקריבה אל הכהן והגישה אל המזבח
(179544, -69, 4);[1, 10, 300, 50];361;נשיא ;47517;(3, 24, 23, 14, 47517);אבן;1;(3, 24, 23, 53, 179544);וידבר משה אל בני ישראל ויוציאו את המקלל אל מחוץ למחנה וירגמו אתו אבן ובני ישראל עשו כאשר צוה יהוה את משה
(212066, -69, 4);[1, 10, 300, 50];361;נשיא ;55906;(4, 14, 22, 8, 55906);אתתי;1;(4, 14, 22, 25, 212066);כי כל האנשים הראים את כבדי ואת אתתי אשר עשיתי במצרים ובמדבר וינסו אתי זה עשר פעמים ולא שמעו בקולי
(236071, -69, 4);[1, 10, 300, 50];361;נשיא ;62179;(4, 28, 19, 10, 62179);אחד;1;(4, 28, 19, 37, 236071);והקרבתם אשה עלה ליהוה פרים בני בקר שנים ואיל אחד ושבעה כבשים בני שנה תמימם יהיו לכם
(251440, -69, 4);[1, 10, 300, 50];361;נשיא ;66066;(5, 1, 27, 4, 66066);בשנאת;4;(5, 1, 27, 23, 251440);ותרגנו באהליכם ותאמרו בשנאת יהוה אתנו הוציאנו מארץ מצרים לתת אתנו ביד האמרי להשמידנו
(120416, -68, 4);[1, 10, 300, 50];361;נשיא ;31762;(2, 28, 41, 11, 31762);ומלאת;4;(2, 28, 41, 41, 120416);והלבשת אתם את אהרן אחיך ואת בניו אתו ומשחת אתם ומלאת את ידם וקדשת אתם וכהנו לי
(135904, -68, 4);[1, 10, 300, 50];361;נשיא ;35833;(2, 37, 24, 5, 35833);אתה;1;(2, 37, 24, 14, 135904);ככר זהב טהור עשה אתה ואת כל כליה
(210045, -68, 4);[1, 10, 300, 50];361;נשיא ;55366;(4, 13, 19, 13, 55366);אשר;1;(4, 13, 19, 40, 210045);ומה הארץ אשר הוא ישב בה הטובה הוא אם רעה ומה הערים אשר הוא יושב בהנה הבמחנים אם במבצרים
(212545, -68, 4);[1, 10, 300, 50];361;נשיא ;56034;(4, 14, 31, 2, 56034);אשר;1;(4, 14, 31, 6, 212545);וטפכם אשר אמרתם לבז יהיה והביאתי אתם וידעו את הארץ אשר מאסתם בה
(248159, -68, 4);[1, 10, 300, 50];361;נשיא ;65209;(4, 35, 17, 1, 65209);ואם;2;(4, 35, 17, 2, 248159);ואם באבן יד אשר ימות בה הכהו וימת רצח הוא מות יומת הרצח
(271427, -68, 4);[1, 10, 300, 50];361;נשיא ;71190;(5, 12, 14, 7, 71190);באחד;2;(5, 12, 14, 22, 271427);כי אם במקום אשר יבחר יהוה באחד שבטיך שם תעלה עלתיך ושם תעשה כל אשר אנכי מצוך
(277697, -68, 4);[1, 10, 300, 50];361;נשיא ;72833;(5, 16, 20, 11, 72833);אלהיך;1;(5, 16, 20, 37, 277697);צדק צדק תרדף למען תחיה וירשת את הארץ אשר יהוה אלהיך נתן לך
(39182, -67, 4);[1, 10, 300, 50];361;נשיא ;10423;(1, 28, 12, 5, 10423);ארצה;1;(1, 28, 12, 16, 39182);ויחלם והנה סלם מצב ארצה וראשו מגיע השמימה והנה מלאכי אלהים עלים וירדים בו
(54176, -67, 4);[1, 10, 300, 50];361;נשיא ;14431;(1, 37, 2, 30, 14431);אביהם;1;(1, 37, 2, 97, 54176);אלה תלדות יעקב יוסף בן שבע עשרה שנה היה רעה את אחיו בצאן והוא נער את בני בלהה ואת בני זלפה נשי אביו ויבא יוסף את דבתם רעה אל אביהם
(130141, -67, 4);[1, 10, 300, 50];361;נשיא ;34353;(2, 34, 20, 13, 34353);ולא;3;(2, 34, 20, 47, 130141);ופטר חמור תפדה בשה ואם לא תפדה וערפתו כל בכור בניך תפדה ולא יראו פני ריקם
(172857, -67, 4);[1, 10, 300, 50];361;נשיא ;45747;(3, 20, 18, 5, 45747);אשה;1;(3, 20, 18, 14, 172857);ואיש אשר ישכב את אשה דוה וגלה את ערותה את מקרה הערה והוא גלתה את מקור דמיה ונכרתו שניהם מקרב עמם
(175282, -67, 4);[1, 10, 300, 50];361;נשיא ;46425;(3, 22, 15, 1, 46425);ולא;3;(3, 22, 15, 3, 175282);ולא יחללו את קדשי בני ישראל את אשר ירימו ליהוה
(179064, -67, 4);[1, 10, 300, 50];361;נשיא ;47381;(3, 24, 11, 10, 47381);אל;1;(3, 24, 11, 38, 179064);ויקב בן האשה הישראלית את השם ויקלל ויביאו אתו אל משה ושם אמו שלמית בת דברי למטה דן
(255931, -67, 4);[1, 10, 300, 50];361;נשיא ;67243;(5, 3, 24, 6, 67243);את;1;(5, 3, 24, 23, 255931);אדני יהוה אתה החלות להראות את עבדך את גדלך ואת ידך החזקה אשר מי אל בשמים ובארץ אשר יעשה כמעשיך וכגבורתך
(5078, -66, 4);[1, 10, 300, 50];361;נשיא ;1350;(1, 4, 19, 7, 1350);האחת;2;(1, 4, 19, 20, 5078);ויקח לו למך שתי נשים שם האחת עדה ושם השנית צלה
(79653, -66, 4);[1, 10, 300, 50];361;נשיא ;21023;(2, 2, 13, 1, 21023);ויצא;4;(2, 2, 13, 4, 79653);ויצא ביום השני והנה שני אנשים עברים נצים ויאמר לרשע למה תכה רעך
(116242, -66, 4);[1, 10, 300, 50];361;נשיא ;30722;(2, 26, 19, 16, 30722);אדנים;1;(2, 26, 19, 63, 116242);וארבעים אדני כסף תעשה תחת עשרים הקרש שני אדנים תחת הקרש האחד לשתי ידתיו ושני אדנים תחת הקרש האחד לשתי ידתיו
(125831, -66, 4);[1, 10, 300, 50];361;נשיא ;33190;(2, 32, 2, 7, 33190);אשר;1;(2, 32, 2, 26, 125831);ויאמר אלהם אהרן פרקו נזמי הזהב אשר באזני נשיכם בניכם ובנתיכם והביאו אלי
(151424, -66, 4);[1, 10, 300, 50];361;נשיא ;39948;(3, 8, 13, 9, 39948);אתם;1;(3, 8, 13, 33, 151424);ויקרב משה את בני אהרן וילבשם כתנת ויחגר אתם אבנט ויחבש להם מגבעות כאשר צוה יהוה את משה
(294685, -66, 4);[1, 10, 300, 50];361;נשיא ;77361;(5, 28, 60, 3, 77361);את;1;(5, 28, 60, 8, 294685);והשיב בך את כל מדוה מצרים אשר יגרת מפניהם ודבקו בך
(18454, -65, 4);[1, 10, 300, 50];361;נשיא ;4949;(1, 16, 3, 18, 4949);לאברם;2;(1, 16, 3, 65, 18454);ותקח שרי אשת אברם את הגר המצרית שפחתה מקץ עשר שנים לשבת אברם בארץ כנען ותתן אתה לאברם אישה לו לאשה
(34742, -65, 4);[1, 10, 300, 50];361;נשיא ;9246;(1, 26, 7, 6, 9246);אחתי;1;(1, 26, 7, 26, 34742);וישאלו אנשי המקום לאשתו ויאמר אחתי הוא כי ירא לאמר אשתי פן יהרגני אנשי המקום על רבקה כי טובת מראה הוא
(65121, -65, 4);[1, 10, 300, 50];361;נשיא ;17277;(1, 43, 3, 1, 17277);ויאמר;3;(1, 43, 3, 3, 65121);ויאמר אליו יהודה לאמר העד העד בנו האיש לאמר לא תראו פני בלתי אחיכם אתכם
(107700, -65, 4);[1, 10, 300, 50];361;נשיא ;28451;(2, 20, 16, 2, 28451);אל;1;(2, 20, 16, 7, 107700);ויאמרו אל משה דבר אתה עמנו ונשמעה ואל ידבר עמנו אלהים פן נמות
(122999, -65, 4);[1, 10, 300, 50];361;נשיא ;32443;(2, 29, 46, 6, 32443);אשר;1;(2, 29, 46, 21, 122999);וידעו כי אני יהוה אלהיהם אשר הוצאתי אתם מארץ מצרים לשכני בתוכם אני יהוה אלהיהם
(149907, -65, 4);[1, 10, 300, 50];361;נשיא ;39546;(3, 7, 20, 7, 39546);אשר;1;(3, 7, 20, 26, 149907);והנפש אשר תאכל בשר מזבח השלמים אשר ליהוה וטמאתו עליו ונכרתה הנפש ההוא מעמיה
(167230, -65, 4);[1, 10, 300, 50];361;נשיא ;44217;(3, 16, 21, 23, 44217);אתם;1;(3, 16, 21, 79, 167230);וסמך אהרן את שתי ידו על ראש השעיר החי והתודה עליו את כל עונת בני ישראל ואת כל פשעיהם לכל חטאתם ונתן אתם על ראש השעיר ושלח ביד איש עתי המדברה
(168334, -65, 4);[1, 10, 300, 50];361;נשיא ;44516;(3, 17, 6, 3, 44516);את;1;(3, 17, 6, 9, 168334);וזרק הכהן את הדם על מזבח יהוה פתח אהל מועד והקטיר החלב לריח ניחח ליהוה
(194934, -65, 4);[1, 10, 300, 50];361;נשיא ;51391;(4, 4, 43, 11, 51391);לצבא;4;(4, 4, 43, 38, 194934);מבן שלשים שנה ומעלה ועד בן חמשים שנה כל הבא לצבא לעבדה באהל מועד
(230534, -65, 4);[1, 10, 300, 50];361;נשיא ;60826;(4, 25, 8, 2, 60826);אחר;1;(4, 25, 8, 5, 230534);ויבא אחר איש ישראל אל הקבה וידקר את שניהם את איש ישראל ואת האשה אל קבתה ותעצר המגפה מעל בני ישראל
(239403, -65, 4);[1, 10, 300, 50];361;נשיא ;62995;(4, 31, 1, 5, 62995);לאמר;2;(4, 31, 1, 16, 239403);וידבר יהוה אל משה לאמר
(251404, -65, 4);[1, 10, 300, 50];361;נשיא ;66059;(5, 1, 26, 5, 66059);את;1;(5, 1, 26, 18, 251404);ולא אביתם לעלת ותמרו את פי יהוה אלהיכם
(47768, -64, 4);[1, 10, 300, 50];361;נשיא ;12721;(1, 32, 24, 6, 12721);את;1;(1, 32, 24, 23, 47768);ויקחם ויעברם את הנחל ויעבר את אשר לו
(71618, -64, 4);[1, 10, 300, 50];361;נשיא ;18936;(1, 46, 30, 5, 18936);אמותה;1;(1, 46, 30, 17, 71618);ויאמר ישראל אל יוסף אמותה הפעם אחרי ראותי את פניך כי עודך חי
(138903, -64, 4);[1, 10, 300, 50];361;נשיא ;36595;(2, 39, 21, 18, 36595);האפד;2;(2, 39, 21, 66, 138903);וירכסו את החשן מטבעתיו אל טבעת האפד בפתיל תכלת להית על חשב האפד ולא יזח החשן מעל האפד כאשר צוה יהוה את משה
(238881, -64, 4);[1, 10, 300, 50];361;נשיא ;62847;(4, 30, 8, 10, 62847);אשר;1;(4, 30, 8, 39, 238881);ושמע אישה ביום שמעו והחריש לה וקמו נדריה ואסרה אשר אסרה על נפשה יקמו
(4043, -63, 4);[1, 10, 300, 50];361;נשיא ;1063;(1, 3, 22, 5, 1063);האדם;2;(1, 3, 22, 18, 4043);ויאמר יהוה אלהים הן האדם היה כאחד ממנו לדעת טוב ורע ועתה פן ישלח ידו ולקח גם מעץ החיים ואכל וחי לעלם
(249226, -63, 4);[1, 10, 300, 50];361;נשיא ;65513;(4, 36, 2, 20, 65513);אחינו;1;(4, 36, 2, 75, 249226);ויאמרו את אדני צוה יהוה לתת את הארץ בנחלה בגורל לבני ישראל ואדני צוה ביהוה לתת את נחלת צלפחד אחינו לבנתיו
(250773, -63, 4);[1, 10, 300, 50];361;נשיא ;65897;(5, 1, 16, 5, 65897);ההוא;4;(5, 1, 16, 20, 250773);ואצוה את שפטיכם בעת ההוא לאמר שמע בין אחיכם ושפטתם צדק בין איש ובין אחיו ובין גרו
(16996, -62, 4);[1, 10, 300, 50];361;נשיא ;4552;(1, 14, 17, 17, 4552);הוא;3;(1, 14, 17, 64, 16996);ויצא מלך סדם לקראתו אחרי שובו מהכות את כדרלעמר ואת המלכים אשר אתו אל עמק שוה הוא עמק המלך
(54588, -62, 4);[1, 10, 300, 50];361;נשיא ;14533;(1, 37, 10, 2, 14533);אל;1;(1, 37, 10, 6, 54588);ויספר אל אביו ואל אחיו ויגער בו אביו ויאמר לו מה החלום הזה אשר חלמת הבוא נבוא אני ואמך ואחיך להשתחות לך ארצה
(119083, -62, 4);[1, 10, 300, 50];361;נשיא ;31417;(2, 28, 15, 17, 31417);אתו;1;(2, 28, 15, 66, 119083);ועשית חשן משפט מעשה חשב כמעשה אפד תעשנו זהב תכלת וארגמן ותולעת שני ושש משזר תעשה אתו
(162436, -62, 4);[1, 10, 300, 50];361;נשיא ;42915;(3, 14, 21, 3, 42915);הוא;3;(3, 14, 21, 8, 162436);ואם דל הוא ואין ידו משגת ולקח כבש אחד אשם לתנופה לכפר עליו ועשרון סלת אחד בלול בשמן למנחה ולג שמן
(300401, -62, 4);[1, 10, 300, 50];361;נשיא ;78828;(5, 31, 29, 17, 78828);באחרית;2;(5, 31, 29, 65, 300401);כי ידעתי אחרי מותי כי השחת תשחתון וסרתם מן הדרך אשר צויתי אתכם וקראת אתכם הרעה באחרית הימים כי תעשו את הרע בעיני יהוה להכעיסו במעשה ידיכם
(13397, -61, 4);[1, 10, 300, 50];361;נשיא ;3592;(1, 11, 16, 3, 3592);ארבע;1;(1, 11, 16, 8, 13397);ויחי עבר ארבע ושלשים שנה ויולד את פלג
(44639, -61, 4);[1, 10, 300, 50];361;נשיא ;11896;(1, 31, 21, 4, 11896);אשר;1;(1, 31, 21, 12, 44639);ויברח הוא וכל אשר לו ויקם ויעבר את הנהר וישם את פניו הר הגלעד
(70038, -61, 4);[1, 10, 300, 50];361;נשיא ;18531;(1, 45, 24, 5, 18531);ויאמר;3;(1, 45, 24, 19, 70038);וישלח את אחיו וילכו ויאמר אלהם אל תרגזו בדרך
(134127, -61, 4);[1, 10, 300, 50];361;נשיא ;35390;(2, 36, 26, 5, 35390);אדנים;1;(2, 36, 26, 20, 134127);וארבעים אדניהם כסף שני אדנים תחת הקרש האחד ושני אדנים תחת הקרש האחד
(177371, -61, 4);[1, 10, 300, 50];361;נשיא ;46958;(3, 23, 22, 20, 46958);אלהיכם;1;(3, 23, 22, 73, 177371);ובקצרכם את קציר ארצכם לא תכלה פאת שדך בקצרך ולקט קצירך לא תלקט לעני ולגר תעזב אתם אני יהוה אלהיכם
(186045, -61, 4);[1, 10, 300, 50];361;נשיא ;49181;(3, 27, 28, 1, 49181);אך;1;(3, 27, 28, 1, 186045);אך כל חרם אשר יחרם איש ליהוה מכל אשר לו מאדם ובהמה ומשדה אחזתו לא ימכר ולא יגאל כל חרם קדש קדשים הוא ליהוה
(197326, -61, 4);[1, 10, 300, 50];361;נשיא ;52033;(4, 6, 8, 5, 52033);הוא;3;(4, 6, 8, 15, 197326);כל ימי נזרו קדש הוא ליהוה
(271804, -61, 4);[1, 10, 300, 50];361;נשיא ;71287;(5, 12, 20, 4, 71287);אלהיך;1;(5, 12, 20, 12, 271804);כי ירחיב יהוה אלהיך את גבלך כאשר דבר לך ואמרת אכלה בשר כי תאוה נפשך לאכל בשר בכל אות נפשך תאכל בשר
(12388, -60, 4);[1, 10, 300, 50];361;נשיא ;3321;(1, 10, 24, 1, 3321);וארפכשד;2;(1, 10, 24, 2, 12388);וארפכשד ילד את שלח ושלח ילד את עבר
(54011, -60, 4);[1, 10, 300, 50];361;נשיא ;14385;(1, 36, 43, 5, 14385);אלה;1;(1, 36, 43, 19, 54011);אלוף מגדיאל אלוף עירם אלה אלופי אדום למשבתם בארץ אחזתם הוא עשו אבי אדום
(87982, -60, 4);[1, 10, 300, 50];361;נשיא ;23195;(2, 8, 1, 15, 23195);היארים;3;(2, 8, 1, 47, 87982);ויאמר יהוה אל משה אמר אל אהרן נטה את ידך במטך על הנהרת על היארים ועל האגמים והעל את הצפרדעים על ארץ מצרים
(134225, -60, 4);[1, 10, 300, 50];361;נשיא ;35412;(2, 36, 29, 2, 35412);תואמם;3;(2, 36, 29, 7, 134225);והיו תואמם מלמטה ויחדו יהיו תמים אל ראשו אל הטבעת האחת כן עשה לשניהם לשני המקצעת
(166525, -60, 4);[1, 10, 300, 50];361;נשיא ;44028;(3, 16, 11, 6, 44028);אשר;1;(3, 16, 11, 20, 166525);והקריב אהרן את פר החטאת אשר לו וכפר בעדו ובעד ביתו ושחט את פר החטאת אשר לו
(251375, -60, 4);[1, 10, 300, 50];361;נשיא ;66052;(5, 1, 25, 15, 66052);אלהינו;1;(5, 1, 25, 62, 251375);ויקחו בידם מפרי הארץ ויורדו אלינו וישבו אתנו דבר ויאמרו טובה הארץ אשר יהוה אלהינו נתן לנו
(94444, -59, 4);[1, 10, 300, 50];361;נשיא ;24930;(2, 12, 10, 10, 24930);באש;2;(2, 12, 10, 34, 94444);ולא תותירו ממנו עד בקר והנתר ממנו עד בקר באש תשרפו
(128869, -59, 4);[1, 10, 300, 50];361;נשיא ;34010;(2, 33, 20, 2, 34010);לא;2;(2, 33, 20, 7, 128869);ויאמר לא תוכל לראת את פני כי לא יראני האדם וחי
(209915, -59, 4);[1, 10, 300, 50];361;נשיא ;55327;(4, 13, 17, 5, 55327);את;1;(4, 13, 17, 16, 209915);וישלח אתם משה לתור את ארץ כנען ויאמר אלהם עלו זה בנגב ועליתם את ההר
(247832, -59, 4);[1, 10, 300, 50];361;נשיא ;65125;(4, 35, 10, 5, 65125);ואמרת;2;(4, 35, 10, 15, 247832);דבר אל בני ישראל ואמרת אלהם כי אתם עברים את הירדן ארצה כנען
